{
  "schema_version": "weather-forecast-quality-scenario/v1",
  "product_family": "short_range",
  "source_revision": "synthetic-short-range-v1",
  "valid_at": "2026-08-20T12:00:00+09:00",
  "truth_as_of": "2026-08-20T13:00:00+09:00",
  "collected_at": "2026-08-20T13:05:00+09:00",
  "evaluation_as_of": "2026-08-20T19:00:00+09:00"
}
